{
  "id": "validation/deprecated-key-is-a-warning",
  "title": "A deprecated key is a warning, not an error",
  "why": "Existing projects legitimately contain deprecated keys; blocking them would make the tool unusable on real data. Flagging them is enough.",
  "referenceData": "demo",
  "operation": {
    "kind": "validate",
    "points": [
      {
        "source": {
          "type": "",
          "filename": "",
          "invalid": {},
          "duplicated_keyname": false,
          "missing_from_source": false
        },
        "ede": {
          "keyname": "",
          "device_obj_instance": null,
          "object_name": "",
          "object_type": null,
          "object_instance": null,
          "description": "",
          "present_value_default": null,
          "min_present_value": null,
          "max_present_value": null,
          "settable": "",
          "commandable": "",
          "supports_cov": "",
          "hi_limit": null,
          "low_limit": null,
          "state_text_reference": null,
          "unit_code": null,
          "vendor_specific_address": null,
          "notification_class": null,
          "object_tag": null,
          "object_tag_text": ""
        },
        "bacnet": {
          "type": "",
          "unit": ""
        },
        "bactwin": {
          "ort": "",
          "gewerk": "HZG",
          "anlage": "ALT",
          "anlage_number": "",
          "sub_anlage_number": "",
          "baugruppe": "",
          "baugruppe_number": "",
          "medium_position": "",
          "aggregat": "",
          "aggregat_number": "",
          "betriebsmittel": "",
          "betriebsmittel_number": "",
          "funktion": "",
          "funktion_number": "",
          "funktion_erweiterung": "",
          "bactwin_name": "",
          "bactwin_description": null
        },
        "state": {
          "ignore": false,
          "reminder": false,
          "comment": "",
          "translation_complete": false,
          "combinations_valid": false,
          "valid_bactwin_rules": false,
          "duplicated_name": false,
          "messages": [],
          "has_error": false
        }
      }
    ]
  },
  "expected": {
    "points": [
      {
        "source": {
          "type": "",
          "filename": "",
          "invalid": {},
          "duplicated_keyname": false,
          "missing_from_source": false
        },
        "ede": {
          "keyname": "",
          "device_obj_instance": null,
          "object_name": "",
          "object_type": null,
          "object_instance": null,
          "description": "",
          "present_value_default": null,
          "min_present_value": null,
          "max_present_value": null,
          "settable": "",
          "commandable": "",
          "supports_cov": "",
          "hi_limit": null,
          "low_limit": null,
          "state_text_reference": null,
          "unit_code": null,
          "vendor_specific_address": null,
          "notification_class": null,
          "object_tag": null,
          "object_tag_text": ""
        },
        "bacnet": {
          "type": "",
          "unit": ""
        },
        "bactwin": {
          "ort": "",
          "gewerk": "HZG",
          "anlage": "ALT",
          "anlage_number": "",
          "sub_anlage_number": "",
          "baugruppe": "",
          "baugruppe_number": "",
          "medium_position": "",
          "aggregat": "",
          "aggregat_number": "",
          "betriebsmittel": "",
          "betriebsmittel_number": "",
          "funktion": "",
          "funktion_number": "",
          "funktion_erweiterung": "",
          "bactwin_name": "",
          "bactwin_description": "?_HZG_Nicht mehr verwenden??_?????_???_?????_?????_?????"
        },
        "state": {
          "ignore": false,
          "reminder": false,
          "comment": "",
          "translation_complete": false,
          "combinations_valid": false,
          "valid_bactwin_rules": true,
          "duplicated_name": false,
          "messages": [
            {
              "level": "warning",
              "code": "DEPRECATED_KEY",
              "params": {
                "value": "ALT",
                "block": "anlage"
              }
            },
            {
              "level": "error",
              "code": "COMBINATION_VIOLATION",
              "params": {
                "field": "anlage",
                "value": "ALT",
                "with": "gewerk HZG"
              }
            }
          ],
          "has_error": true
        }
      }
    ]
  }
}
