{
  "id": "parse-ede/mixed-encoding-keeps-both",
  "title": "A UTF-8 file with a stray Windows-1252 byte keeps both",
  "why": "Tools append to files in another encoding. Reading the whole file either way would break the other part.",
  "referenceData": "demo",
  "operation": {
    "kind": "parse_ede",
    "contentHex": "23456e67696e656572696e672d446174612d45786368616e6765202d20746573740a50524f4a4543545f4e414d453b44656d6f0a56455253494f4e5f4f465f5245464552454e434546494c453b310a54494d455354414d505f4f465f4c4153545f4348414e47453b30312e31302e323032360a415554484f525f4f465f4c4153545f4348414e47453b746573740a56455253494f4e5f4f465f4c41594f55543b322e330a236d616e6461746f72793b6d616e6461746f72793b6d616e6461746f72793b6d616e6461746f72793b6d616e6461746f72793b6f7074696f6e616c0a23206b65796e616d653b646576696365206f626a2e2d696e7374616e63653b6f626a6563742d6e616d653b6f626a6563742d747970653b6f626a6563742d696e7374616e63653b6465736372697074696f6e0a4b313b313b413b303b313b4175c39f656e2035b00a",
    "filename": "test.csv"
  },
  "expected": {
    "warnings": [
      {
        "code": "EDE_ENCODING_MIXED",
        "params": {
          "count": "1"
        }
      }
    ]
  }
}
