{
  "id": "validation/unit-code-zero-is-square-meters",
  "title": "Unit code 0 is square metres, a known unit",
  "why": "Code 0 is m² in the BACnet unit table, not \"no unit\"; a point without a unit has an empty cell.",
  "referenceData": "demo",
  "operation": {
    "kind": "validate",
    "points": [
      {
        "source": {
          "type": "",
          "filename": "",
          "invalid": {},
          "duplicated_keyname": false,
          "missing_from_source": false
        },
        "ede": {
          "keyname": "",
          "device_obj_instance": null,
          "object_name": "",
          "object_type": 0,
          "object_instance": null,
          "description": "",
          "present_value_default": null,
          "min_present_value": null,
          "max_present_value": null,
          "settable": "",
          "commandable": "",
          "supports_cov": "",
          "hi_limit": null,
          "low_limit": null,
          "state_text_reference": null,
          "unit_code": 0,
          "vendor_specific_address": null,
          "notification_class": null,
          "object_tag": null,
          "object_tag_text": ""
        },
        "bacnet": {
          "type": "",
          "unit": ""
        },
        "bactwin": {
          "ort": "",
          "gewerk": "",
          "anlage": "",
          "anlage_number": "",
          "sub_anlage_number": "",
          "baugruppe": "",
          "baugruppe_number": "",
          "medium_position": "",
          "aggregat": "",
          "aggregat_number": "",
          "betriebsmittel": "",
          "betriebsmittel_number": "",
          "funktion": "",
          "funktion_number": "",
          "funktion_erweiterung": "",
          "bactwin_name": "",
          "bactwin_description": null
        },
        "state": {
          "ignore": false,
          "reminder": false,
          "comment": "",
          "translation_complete": false,
          "combinations_valid": false,
          "valid_bactwin_rules": false,
          "duplicated_name": false,
          "messages": [],
          "has_error": false
        }
      }
    ]
  },
  "expected": {
    "points": [
      {
        "source": {
          "type": "",
          "filename": "",
          "invalid": {},
          "duplicated_keyname": false,
          "missing_from_source": false
        },
        "ede": {
          "keyname": "",
          "device_obj_instance": null,
          "object_name": "",
          "object_type": 0,
          "object_instance": null,
          "description": "",
          "present_value_default": null,
          "min_present_value": null,
          "max_present_value": null,
          "settable": "",
          "commandable": "",
          "supports_cov": "",
          "hi_limit": null,
          "low_limit": null,
          "state_text_reference": null,
          "unit_code": 0,
          "vendor_specific_address": null,
          "notification_class": null,
          "object_tag": null,
          "object_tag_text": ""
        },
        "bacnet": {
          "type": "AI",
          "unit": "m²"
        },
        "bactwin": {
          "ort": "",
          "gewerk": "",
          "anlage": "",
          "anlage_number": "",
          "sub_anlage_number": "",
          "baugruppe": "",
          "baugruppe_number": "",
          "medium_position": "",
          "aggregat": "",
          "aggregat_number": "",
          "betriebsmittel": "",
          "betriebsmittel_number": "",
          "funktion": "",
          "funktion_number": "",
          "funktion_erweiterung": "",
          "bactwin_name": "",
          "bactwin_description": "?_???_?????_?????_???_?????_?????_?????"
        },
        "state": {
          "ignore": false,
          "reminder": false,
          "comment": "",
          "translation_complete": false,
          "combinations_valid": null,
          "valid_bactwin_rules": true,
          "duplicated_name": false,
          "messages": [],
          "has_error": false
        }
      }
    ]
  }
}
