{
  "id": "export/replacement-csv-leaves-out-devices",
  "title": "Replacement CSV leaves out device objects",
  "why": "A device object (object type 8) is the controller, not a data point with a time series; the partner system has nothing to rename. It is left out and counted apart from the unnamed points, even when it has a BACtwin name.",
  "referenceData": "demo",
  "operation": {
    "kind": "export",
    "format": "replacement",
    "scope": "all",
    "points": [
      {
        "source": {
          "type": "",
          "filename": "",
          "invalid": {},
          "duplicated_keyname": false,
          "missing_from_source": false
        },
        "ede": {
          "keyname": "",
          "device_obj_instance": null,
          "object_name": "AHU07_ZUL_TEMP",
          "object_type": 0,
          "object_instance": null,
          "description": "",
          "present_value_default": null,
          "min_present_value": null,
          "max_present_value": null,
          "settable": "",
          "commandable": "",
          "supports_cov": "",
          "hi_limit": null,
          "low_limit": null,
          "state_text_reference": null,
          "unit_code": 62,
          "vendor_specific_address": null,
          "notification_class": null,
          "object_tag": null,
          "object_tag_text": ""
        },
        "bacnet": {
          "type": "",
          "unit": ""
        },
        "bactwin": {
          "ort": "Halle",
          "gewerk": "HZG",
          "anlage": "VTA",
          "anlage_number": "1",
          "sub_anlage_number": "",
          "baugruppe": "HZK",
          "baugruppe_number": "2",
          "medium_position": "HZ~",
          "aggregat": "WMZ",
          "aggregat_number": "3",
          "betriebsmittel": "TD~",
          "betriebsmittel_number": "4",
          "funktion": "MW~",
          "funktion_number": "5",
          "funktion_erweiterung": "",
          "bactwin_name": "Halle_HZG_VTA1_HZK2_HZ~_WMZ3_TD~4_MW~5",
          "bactwin_description": "Halle_HZG_Verteilung1_Heizkreis2_Heizwasser_Zaehler3_Temperatursensor4_Gemessener Wert5"
        },
        "state": {
          "ignore": false,
          "reminder": false,
          "comment": "needs a second look",
          "translation_complete": true,
          "combinations_valid": true,
          "valid_bactwin_rules": true,
          "duplicated_name": false,
          "messages": [],
          "has_error": false
        }
      },
      {
        "source": {
          "type": "",
          "filename": "",
          "invalid": {},
          "duplicated_keyname": false,
          "missing_from_source": false
        },
        "ede": {
          "keyname": "",
          "device_obj_instance": null,
          "object_name": "quoted,\"name\"",
          "object_type": 0,
          "object_instance": null,
          "description": "",
          "present_value_default": null,
          "min_present_value": null,
          "max_present_value": null,
          "settable": "",
          "commandable": "",
          "supports_cov": "",
          "hi_limit": null,
          "low_limit": null,
          "state_text_reference": null,
          "unit_code": 62,
          "vendor_specific_address": null,
          "notification_class": null,
          "object_tag": null,
          "object_tag_text": ""
        },
        "bacnet": {
          "type": "",
          "unit": ""
        },
        "bactwin": {
          "ort": "",
          "gewerk": "",
          "anlage": "",
          "anlage_number": "",
          "sub_anlage_number": "",
          "baugruppe": "",
          "baugruppe_number": "",
          "medium_position": "",
          "aggregat": "",
          "aggregat_number": "",
          "betriebsmittel": "",
          "betriebsmittel_number": "",
          "funktion": "",
          "funktion_number": "",
          "funktion_erweiterung": "",
          "bactwin_name": "Q_NAME",
          "bactwin_description": "?_???_?????_?????_???_?????_?????_?????"
        },
        "state": {
          "ignore": false,
          "reminder": false,
          "comment": "",
          "translation_complete": false,
          "combinations_valid": true,
          "valid_bactwin_rules": true,
          "duplicated_name": false,
          "messages": [],
          "has_error": false
        }
      },
      {
        "source": {
          "type": "",
          "filename": "",
          "invalid": {},
          "duplicated_keyname": false,
          "missing_from_source": false
        },
        "ede": {
          "keyname": "",
          "device_obj_instance": null,
          "object_name": "IGNORED",
          "object_type": null,
          "object_instance": null,
          "description": "",
          "present_value_default": null,
          "min_present_value": null,
          "max_present_value": null,
          "settable": "",
          "commandable": "",
          "supports_cov": "",
          "hi_limit": null,
          "low_limit": null,
          "state_text_reference": null,
          "unit_code": null,
          "vendor_specific_address": null,
          "notification_class": null,
          "object_tag": null,
          "object_tag_text": ""
        },
        "bacnet": {
          "type": "",
          "unit": ""
        },
        "bactwin": {
          "ort": "",
          "gewerk": "",
          "anlage": "",
          "anlage_number": "",
          "sub_anlage_number": "",
          "baugruppe": "",
          "baugruppe_number": "",
          "medium_position": "",
          "aggregat": "",
          "aggregat_number": "",
          "betriebsmittel": "",
          "betriebsmittel_number": "",
          "funktion": "",
          "funktion_number": "",
          "funktion_erweiterung": "",
          "bactwin_name": "",
          "bactwin_description": "?_???_?????_?????_???_?????_?????_?????"
        },
        "state": {
          "ignore": true,
          "reminder": false,
          "comment": "",
          "translation_complete": false,
          "combinations_valid": true,
          "valid_bactwin_rules": true,
          "duplicated_name": false,
          "messages": [],
          "has_error": false
        }
      },
      {
        "source": {
          "type": "",
          "filename": "",
          "invalid": {},
          "duplicated_keyname": false,
          "missing_from_source": false
        },
        "ede": {
          "keyname": "",
          "device_obj_instance": null,
          "object_name": "AS111012",
          "object_type": 8,
          "object_instance": null,
          "description": "",
          "present_value_default": null,
          "min_present_value": null,
          "max_present_value": null,
          "settable": "",
          "commandable": "",
          "supports_cov": "",
          "hi_limit": null,
          "low_limit": null,
          "state_text_reference": null,
          "unit_code": 62,
          "vendor_specific_address": null,
          "notification_class": null,
          "object_tag": null,
          "object_tag_text": ""
        },
        "bacnet": {
          "type": "",
          "unit": ""
        },
        "bactwin": {
          "ort": "Halle",
          "gewerk": "HZG",
          "anlage": "VTA",
          "anlage_number": "1",
          "sub_anlage_number": "",
          "baugruppe": "HZK",
          "baugruppe_number": "2",
          "medium_position": "HZ~",
          "aggregat": "WMZ",
          "aggregat_number": "3",
          "betriebsmittel": "TD~",
          "betriebsmittel_number": "4",
          "funktion": "MW~",
          "funktion_number": "5",
          "funktion_erweiterung": "",
          "bactwin_name": "Halle_HZG_VTA1_HZK2_HZ~_WMZ3_TD~4_MW~5",
          "bactwin_description": "Halle_HZG_Verteilung1_Heizkreis2_Heizwasser_Zaehler3_Temperatursensor4_Gemessener Wert5"
        },
        "state": {
          "ignore": false,
          "reminder": false,
          "comment": "needs a second look",
          "translation_complete": true,
          "combinations_valid": true,
          "valid_bactwin_rules": true,
          "duplicated_name": false,
          "messages": [],
          "has_error": false
        }
      }
    ]
  },
  "expected": {
    "content": "Key,Command,Replacement,Comment\r\nAHU07_ZUL_TEMP,replace,Halle_HZG_VTA1_HZK2_HZ~_WMZ3_TD~4_MW~5,needs a second look\r\n\"quoted,\"\"name\"\"\",replace,Q_NAME,\r\n",
    "leftOut": 1,
    "devices": 1
  }
}
