{
  "id": "export/datapoints-columns",
  "title": "The data-point table's column set",
  "why": "Columns come from an empty point, so the same columns appear whatever is exported - including nothing. A column set that varied with the data would break every consumer.",
  "referenceData": "demo",
  "operation": {
    "kind": "export",
    "format": "xlsx_columns",
    "scope": "all",
    "points": [
      {
        "source": {
          "type": "",
          "filename": "",
          "invalid": {},
          "duplicated_keyname": false,
          "missing_from_source": false
        },
        "ede": {
          "keyname": "",
          "device_obj_instance": null,
          "object_name": "AHU07_ZUL_TEMP",
          "object_type": 0,
          "object_instance": null,
          "description": "",
          "present_value_default": null,
          "min_present_value": null,
          "max_present_value": null,
          "settable": "",
          "commandable": "",
          "supports_cov": "",
          "hi_limit": null,
          "low_limit": null,
          "state_text_reference": null,
          "unit_code": 62,
          "vendor_specific_address": null,
          "notification_class": null,
          "object_tag": null,
          "object_tag_text": ""
        },
        "bacnet": {
          "type": "",
          "unit": ""
        },
        "bactwin": {
          "ort": "Halle",
          "gewerk": "HZG",
          "anlage": "VTA",
          "anlage_number": "1",
          "sub_anlage_number": "",
          "baugruppe": "HZK",
          "baugruppe_number": "2",
          "medium_position": "HZ~",
          "aggregat": "WMZ",
          "aggregat_number": "3",
          "betriebsmittel": "TD~",
          "betriebsmittel_number": "4",
          "funktion": "MW~",
          "funktion_number": "5",
          "funktion_erweiterung": "",
          "bactwin_name": "Halle_HZG_VTA1_HZK2_HZ~_WMZ3_TD~4_MW~5",
          "bactwin_description": "Halle_HZG_Verteilung1_Heizkreis2_Heizwasser_Zaehler3_Temperatursensor4_Gemessener Wert5"
        },
        "state": {
          "ignore": false,
          "reminder": false,
          "comment": "needs a second look",
          "translation_complete": true,
          "combinations_valid": true,
          "valid_bactwin_rules": true,
          "duplicated_name": false,
          "messages": [],
          "has_error": false
        }
      },
      {
        "source": {
          "type": "",
          "filename": "",
          "invalid": {},
          "duplicated_keyname": false,
          "missing_from_source": false
        },
        "ede": {
          "keyname": "",
          "device_obj_instance": null,
          "object_name": "quoted,\"name\"",
          "object_type": 0,
          "object_instance": null,
          "description": "",
          "present_value_default": null,
          "min_present_value": null,
          "max_present_value": null,
          "settable": "",
          "commandable": "",
          "supports_cov": "",
          "hi_limit": null,
          "low_limit": null,
          "state_text_reference": null,
          "unit_code": 62,
          "vendor_specific_address": null,
          "notification_class": null,
          "object_tag": null,
          "object_tag_text": ""
        },
        "bacnet": {
          "type": "",
          "unit": ""
        },
        "bactwin": {
          "ort": "",
          "gewerk": "",
          "anlage": "",
          "anlage_number": "",
          "sub_anlage_number": "",
          "baugruppe": "",
          "baugruppe_number": "",
          "medium_position": "",
          "aggregat": "",
          "aggregat_number": "",
          "betriebsmittel": "",
          "betriebsmittel_number": "",
          "funktion": "",
          "funktion_number": "",
          "funktion_erweiterung": "",
          "bactwin_name": "",
          "bactwin_description": "?_???_?????_?????_???_?????_?????_?????"
        },
        "state": {
          "ignore": false,
          "reminder": false,
          "comment": "",
          "translation_complete": false,
          "combinations_valid": true,
          "valid_bactwin_rules": true,
          "duplicated_name": false,
          "messages": [],
          "has_error": false
        }
      },
      {
        "source": {
          "type": "",
          "filename": "",
          "invalid": {},
          "duplicated_keyname": false,
          "missing_from_source": false
        },
        "ede": {
          "keyname": "",
          "device_obj_instance": null,
          "object_name": "IGNORED",
          "object_type": null,
          "object_instance": null,
          "description": "",
          "present_value_default": null,
          "min_present_value": null,
          "max_present_value": null,
          "settable": "",
          "commandable": "",
          "supports_cov": "",
          "hi_limit": null,
          "low_limit": null,
          "state_text_reference": null,
          "unit_code": null,
          "vendor_specific_address": null,
          "notification_class": null,
          "object_tag": null,
          "object_tag_text": ""
        },
        "bacnet": {
          "type": "",
          "unit": ""
        },
        "bactwin": {
          "ort": "",
          "gewerk": "",
          "anlage": "",
          "anlage_number": "",
          "sub_anlage_number": "",
          "baugruppe": "",
          "baugruppe_number": "",
          "medium_position": "",
          "aggregat": "",
          "aggregat_number": "",
          "betriebsmittel": "",
          "betriebsmittel_number": "",
          "funktion": "",
          "funktion_number": "",
          "funktion_erweiterung": "",
          "bactwin_name": "",
          "bactwin_description": "?_???_?????_?????_???_?????_?????_?????"
        },
        "state": {
          "ignore": true,
          "reminder": false,
          "comment": "",
          "translation_complete": false,
          "combinations_valid": true,
          "valid_bactwin_rules": true,
          "duplicated_name": false,
          "messages": [],
          "has_error": false
        }
      }
    ]
  },
  "expected": {
    "columns": [
      "source.type",
      "source.filename",
      "source.duplicated_keyname",
      "source.missing_from_source",
      "ede.keyname",
      "ede.device_obj_instance",
      "ede.object_name",
      "ede.object_type",
      "ede.object_instance",
      "ede.description",
      "ede.present_value_default",
      "ede.min_present_value",
      "ede.max_present_value",
      "ede.settable",
      "ede.commandable",
      "ede.supports_cov",
      "ede.hi_limit",
      "ede.low_limit",
      "ede.state_text_reference",
      "ede.unit_code",
      "ede.vendor_specific_address",
      "ede.notification_class",
      "ede.object_tag",
      "ede.object_tag_text",
      "bacnet.type",
      "bacnet.unit",
      "bactwin.ort",
      "bactwin.gewerk",
      "bactwin.anlage",
      "bactwin.anlage_number",
      "bactwin.sub_anlage_number",
      "bactwin.baugruppe",
      "bactwin.baugruppe_number",
      "bactwin.medium_position",
      "bactwin.aggregat",
      "bactwin.aggregat_number",
      "bactwin.betriebsmittel",
      "bactwin.betriebsmittel_number",
      "bactwin.funktion",
      "bactwin.funktion_number",
      "bactwin.funktion_erweiterung",
      "bactwin.bactwin_name",
      "bactwin.bactwin_description",
      "state.ignore",
      "state.reminder",
      "state.comment",
      "state.translation_complete",
      "state.combinations_valid",
      "state.valid_bactwin_rules",
      "state.duplicated_name",
      "state.has_error"
    ]
  }
}
